Recipe Name,Calories,Personal Points,Image URL,Recipe Keys,Summary,URL
Everything Bagel Pigs in a Blanket,Cals:160,3,https://www.skinnytaste.com/wp-content/uploads/2022/11/Mini-Bagel-Dogs-8.jpg,KF,"Mini Bagel Dogs, or pigs in a blanket, make a great game day appetizer or kid-friendly after- school snack!",https://www.skinnytaste.com/everything-bagel-pigs-in-a-blanket/
Garlic-Ginger Chicken Stir-Fry,Cals:450,7,https://www.skinnytaste.com/wp-content/uploads/2022/11/Garlic-Ginger-Chicken-Stir-Fry-6.jpg,"DF, GF, LC","Garlic-Ginger Chicken Stir-Fry is a quick and easy stir-fry with chicken breast, bok choy, red onion, peanuts and basil.",https://www.skinnytaste.com/garlic-ginger-chicken-stir-fry/
Garlic Butter Mushrooms,Cals:111,4,https://www.skinnytaste.com/wp-content/uploads/2022/11/Garlic-Butter-Mushrooms-8.jpg,"GF, LC, Q, V","These 15-minute, umami-loaded Garlic Butter Mushrooms are a low-carb, low-calorie side dish that pairs well with just about anything.",https://www.skinnytaste.com/garlic-butter-mushrooms/
"Sweet Potato Soup with Sausage (Slow Cooker, Instant Pot, Stove)",Cals:265,4,https://www.skinnytaste.com/wp-content/uploads/2022/11/Slow-Cooker-Creamy-Sausage-Kale-Sweet-Potato-Soup-10.jpg,"DF, FM, GF, PC, SC, W","This creamy, Sweet Potato Soup with Sausage and Kale is a hearty, gluten-free, dairy-free soup you’ll want to add to your soup rotation! Slow Cooker, Instant Pot or Stove Top directions!",https://www.skinnytaste.com/sweet-potato-soup-with-sausage-and-kale/
Instant Pot Bolognese Sauce,Cals:191,3,https://www.skinnytaste.com/wp-content/uploads/2017/11/instant-pot-bolognese-1-11.jpg,"FM, GF, HP, KF, LC, PC","Instant Pot bolognese sauceis the best! This easy bolognese sauce recipe has all the flavor that comes with simmering for hours, and it's ready in a fraction of the time.",https://www.skinnytaste.com/bolognese-sauce-recipe-instant-pot/
"Healing Turmeric Chicken Noodle Soup (GF, DF)",Cals:386,7,https://www.skinnytaste.com/wp-content/uploads/2022/10/Turmeric-Chicken-Noodle-Soup-9.jpg,"DF, GF","This healthy bowl of Turmeric Chicken Noodle Soup is a delicious, anti-inflammatory soup loaded with vegetables, chicken, and rice noodles.",https://www.skinnytaste.com/turmeric-chicken-noodle-soup/
Avocado Toast with Egg (4 Ways),Cals:229,3,https://www.skinnytaste.com/wp-content/uploads/2015/01/Avocado-Toast-with-Egg-10.jpg,"DF, GF, HF, Q, V","Avocado toast with egg, 4 ways—quick, healthy, and protein-packed for any morning.",https://www.skinnytaste.com/avocado-toast-with-sunny-side-egg/
Apple Pie Overnight Oats,Cals:361,6,https://www.skinnytaste.com/wp-content/uploads/2022/10/Apple-Pie-Overnight-Oats-3.jpg,"DF, GF, HF, MP, V","This cozy Apple Pie Overnight Oats recipe with apples, cinnamon, maple syrup, oats, chia seeds and walnuts, tastes just like apple pie!",https://www.skinnytaste.com/apple-pie-overnight-oats/
Blackened Air Fryer Salmon Bites,Cals:251,0,https://www.skinnytaste.com/wp-content/uploads/2022/10/Blackended-Air-Fryer-Salmon-Bites-11-copy.jpg,"AF, DF, GF, HP, LC, Q, W","Blackened Air Fryer Salmon Bites are great on top of a salad, served with rice or your favorite grain, or in a bowl with veggies and sauce.",https://www.skinnytaste.com/blackened-air-fryer-salmon-bites/
Sweet Potato Turkey Meatloaf,Cals:264,2,https://www.skinnytaste.com/wp-content/uploads/2022/10/Turkey-Sweet-Potato-Meatloaf-5.jpg,"DF, FM, GF, W","This easy, gluten-free, dairy-free Sweet Potato Turkey Meatloaf puts a fun healthy spin on my classic turkey meatloaf.",https://www.skinnytaste.com/sweet-potato-turkey-meatloaf/
Lemony Hearts of Palm Salad with Avocado,Cals:145,4,https://www.skinnytaste.com/wp-content/uploads/2022/10/Lemony-Hearts-of-Palm-and-Avocado-Salad-2.jpg,"DF, GF, LC, Q, V, W",This Lemony Hearts of Palm and Avocado Salad is a fast and easy side salad recipe or make it a main dish with your favorite protein.,https://www.skinnytaste.com/hearts-of-palm-salad-with-avocado/
Black Bean Soup (Freezer Friendly),Cals:256,1,https://www.skinnytaste.com/wp-content/uploads/2010/09/Black-Bean-Soup-5.jpg,"DF, FM, GF, HF, V",A healthy and savory black bean soup recipe that is easy to prepare. Perfect for those cold winter days. Freezer friendly!,https://www.skinnytaste.com/black-bean-soup/
Tofu Tacos with Potatoes and Jalapeños,Cals:444,7,https://www.skinnytaste.com/wp-content/uploads/2022/10/Roasted-Tofu-Tacos-with-Potatoes-and-Jalapeños-8.jpg,"DF, GF, HF, V",These vegan Tofu Tacos with Potatoes and Jalapeños are great when you want a plant-based taco that still has lots of protein.,https://www.skinnytaste.com/tofu-tacos-with-potatoes-and-jalapenos/
Pizza Sausage Rolls,Cals:302,8,https://www.skinnytaste.com/wp-content/uploads/2020/10/Pizza-Sausage-Rolls-12.jpg,"GF, KF","Pizza Sausage Rolls wrapped in bagel dough with Italian chicken sausage, marinara and mozzarella make a fun appetizer or snack your whole family will love.",https://www.skinnytaste.com/pizza-sausage-rolls/
Korean-Inspired Salmon Tacos with Spicy Slaw,Cals:404,7,https://www.skinnytaste.com/wp-content/uploads/2022/10/Korean-Inspired-Salmon-Tacos-with-Spicy-Slaw-4.jpg,"DF, GF, HP, HF",Korean-Inspired Salmon Tacos with Spicy Gochujang Slaw is a delicious way to switch up your fish taco game!,https://www.skinnytaste.com/korean-inspired-salmon-tacos/
Creamy Pumpkin Polenta,Cals:133,6,https://www.skinnytaste.com/wp-content/uploads/2022/10/Pumpkin-Polenta.jpg,"GF, Q, V","There’s no cream in this Creamy Pumpkin Polenta. Instead, this polenta is made with pumpkin puree, Pecorino Romano, and a pinch of nutmeg.",https://www.skinnytaste.com/creamy-pumpkin-polenta/
Pumpkin Banana Bread,Cals:146.5,4,https://www.skinnytaste.com/wp-content/uploads/2009/10/Pumpkin-Banana-Bread-6.jpg,V,"If you love all things pumpkin and banana bread, you're going to love this moist and delicious Pumpkin Banana Bread made with pumpkin puree and pumpkin spices.",https://www.skinnytaste.com/pumpkin-banana-bread/
Quick Black Beans Recipe,Cals:135,2,https://www.skinnytaste.com/wp-content/uploads/2022/10/Quick-Black-Beans-7.jpg,"GF, HF, Q, V",How to cook the easiest canned black beans in 20 minutes! This recipe transforms a can of black beans into a flavor-packed side dish or meatless meal.,https://www.skinnytaste.com/quick-black-beans-recipe/
Slow Cooker Ground Beef Ragu,Cals:176,1,https://www.skinnytaste.com/wp-content/uploads/2022/10/Slow-Cooker-Beef-Ragu-9.jpg,"FM, GF, HP, MP, SC","Beef Ragu in the slow cooker, made with lean ground beef, sausage, onions, carrots, and celery is perfect over pappardelle or your favorite pasta.",https://www.skinnytaste.com/slow-cooker-beef-ragu/
Air Fryer Butternut Squash,Cals:113,1,https://www.skinnytaste.com/wp-content/uploads/2022/10/Air-Fryer-Butternut-Squash-3.jpg,"AF, DF, GF, Q, V","An easy recipe for Air Fryer Butternut Squash with a hint of spices. This healthy side dish is quick, tender and delicious!",https://www.skinnytaste.com/air-fryer-butternut-squash/
Mexican Layer Dip,Cals:173,3,https://www.skinnytaste.com/wp-content/uploads/2019/10/Mexican-Hot-Bean-Dip-11-1.jpg,"GF, Q","This cheesy, baked Mexican Layer Dip is made with spiced ground turkey, re-fried beans, salsa, green chilies, tomatoes, cheese and avocado. It's so good!",https://www.skinnytaste.com/mexican-layer-dip/
"Fall Brussels Sprout Salad with Apples, Pecans, and Blue Cheese",Cals:202,5,https://www.skinnytaste.com/wp-content/uploads/2022/10/Fall-Brussels-Sprouts-Salad-with-Apple-Pecans-and-Blue-Cheese-8.jpg,"GF, HF, Q, V","This Fall Brussels Sprout Salad with apples, pecans, and blue cheese is a great side salad with roasted chicken, pork or Thanksgiving turkey.",https://www.skinnytaste.com/fall-brussels-sprout-salad-with-apples/
Lox and Eggs with Onions,Cals:279,3,https://www.skinnytaste.com/wp-content/uploads/2022/09/Lox-Eggs-and-Onions-2-1.jpg,"DF, GF, HP, LC, Q","Lox and Eggs with Onions, also called a LEO scramble takes “ordinary” scrambled eggs to “gourmet” in about 15 minutes!",https://www.skinnytaste.com/lox-and-eggs-with-onions/
Whole Wheat Pumpkin Pancakes with Pecans,Cals:234,7,https://www.skinnytaste.com/wp-content/uploads/2013/10/Whole-Wheat-Pumpkin-Pecan-Pancakes-5.jpg,"KF, Q, V","Made with whole wheat flour, pumpkin puree, pumpkin pie spice, and pecans, thesePumpkin Pancakesare soft, fluffy, and filled with fall flavor. A quick and easy breakfast and the leftovers freeze well too.",https://www.skinnytaste.com/whole-wheat-pumpkin-pecan-pancakes/
Air Fryer Salmon Fish Sandwich,Cals:493,9,https://www.skinnytaste.com/wp-content/uploads/2022/10/Air-Fryer-Salmon-Sandwich-6.jpg,"AF, GF, HP, KF, Q","For a healthier fish sandwich loaded with omega-3s, try this Air Fryer Salmon Sandwich with lemon-caper mayo!",https://www.skinnytaste.com/air-fryer-salmon-sandwich/
Chicken Taco Poblano Rice Bowls,Cals:475,8,https://www.skinnytaste.com/wp-content/uploads/2020/09/Chicken-Taco-Poblano-Rice-Bowls-6.jpg,"GF, HF, MP, Q",These quick and easy Chicken Taco Poblano Rice Bowls are perfect for dinner or to make ahead for meal prep!,https://www.skinnytaste.com/chicken-taco-poblano-rice-bowls/
Peanut Butter Banana Muffins,Cals:192,6,https://www.skinnytaste.com/wp-content/uploads/2022/09/peanut-butter-banana-muffins-8.jpg,"FM, V",Peanut Butter Banana Muffins are proof that banana bread and peanut butter go together really well! Stuffed with extra peanut butter in the center!,https://www.skinnytaste.com/low-fat-peanut-butter-banana-muffins/
Turmeric Roasted Sweet Potato and Macadamia Soup,Cals:199,3,https://www.skinnytaste.com/wp-content/uploads/2017/01/Turmeric-Roasted-Sweet-Potato-and-Macadamia-Soup-1-3.jpg,"DF, FM, GF, HF, V, W","This vegan, Turmeric Roasted Sweet Potato Soup is creamy and dairy-free with macadamia nuts, ginger, and a squeeze of lime juice.",https://www.skinnytaste.com/turmeric-roasted-sweet-potato-and-macadamia-soup/
"Sheet Pan Baked Feta with Broccolini, Tomatoes and Chickpeas",Cals:372,9,https://www.skinnytaste.com/wp-content/uploads/2022/09/Sheet-Pan-Baked-Feta-with-Chickpeas-Broccolini-and-Tomatoes-9.jpg,"GF, HF, LC, V","Sheet Pan Baked Feta with Broccolini, Tomatoes and Chickpeas",https://www.skinnytaste.com/sheet-pan-baked-feta-with-broccolini/
Creamy Potato Leek Soup,Cals:133,2,https://www.skinnytaste.com/wp-content/uploads/2018/10/POTATO-LEEK-SOUP2.-5-2.jpg,"FM, GF, KF, Q, V","This Potato Leek Soup is an easy recipe done in just 30 minutes! It's rich and creamy, but it's made with milk instead of heavy cream.",https://www.skinnytaste.com/potato-leek-soup/
Fall Fruit Salad with Apples and Grapes,Cals:209,6,https://www.skinnytaste.com/wp-content/uploads/2011/09/Autumn-Apple-and-Grape-Medley-8.jpg,"GF, KF, Q, V",This easy fall fruit salad is made with sweet apples and grapes in a creamy yogurt-cream cheese sauce topped with crushed walnuts and brown sugar–the perfect fall treat or dessert.,https://www.skinnytaste.com/autumn-apple-and-grape-medley/
Creamy Sausage and Potato Soup,Cals:402,5,https://www.skinnytaste.com/wp-content/uploads/2022/09/Creamy-Potato-and-Sausage-Soup-5.jpg,"DF, GF, HF","This easy, comforting sausage and potato soup is hearty and dairy-free, made creamy by pureeing cannellini beans.",https://www.skinnytaste.com/creamy-sausage-and-potato-soup/
Maple Roasted Butternut Squash,Cals:104,3,https://www.skinnytaste.com/wp-content/uploads/2020/10/Maple-Roasted-Butternut-Squash-7.jpg,"DF, GF, V","Maple Roasted Butternut Squash, a simple fall side dish with 3 ingredients; butternut squash, pure maple syrup, and oil, plus salt and pepper!",https://www.skinnytaste.com/maple-roasted-butternut-squash/
Parmesan-Herb Baked Salmon,Cals:256,2,https://www.skinnytaste.com/wp-content/uploads/2022/09/Parmesan-Herb-Baked-Salmon-6-2.jpg,"GF, HP, LC, Q",This easy Parmesan Herb Baked Salmon recipe is flaky and tender with incredible flavor – perfect for company or busy weeknights.,https://www.skinnytaste.com/parmesan-herb-baked-salmon/
Avocado Toast with Halloumi and Egg,Cals:295,7,https://www.skinnytaste.com/wp-content/uploads/2022/09/Avocado-Toast-4.jpg,"Q, V","Avocado Toast with Halloumi and Soft Boiled Egg is a fresh spin on avocado toast made with roasted peppers, 7-minute soft-boiled eggs, and sunflower seeds.",https://www.skinnytaste.com/avocado-toast-with-halloumi-and-egg/
Pumpkin Cream Cheese Muffins,Cals:170,8,https://www.skinnytaste.com/wp-content/uploads/2019/10/Pumpkin-Cream-Cheese-Muffins-5-1.jpg,"FM, V","Pumpkin Cream Cheese Muffins are moist, delicious and perfectly spiced! A delicious fall breakfast made with a cream cheese swirl.",https://www.skinnytaste.com/pumpkin-cream-cheese-muffins/
Chicken Enchilada Stuffed Zucchini Boats,Cals:232,3,https://www.skinnytaste.com/wp-content/uploads/2012/08/Chicken-Enchilada-Stuffed-Zucchini-Boats-7.jpg,"GF, HF, LC","Chicken Enchilada Stuffed Zucchini Boats filled with shredded chicken, enchilada sauce, cheese, and scallions is a tasty twist on a Mexican favorite.",https://www.skinnytaste.com/chicken-enchilada-stuffed-zucchini-boats/
Pumpkin Overnight Oats,Cals:269,4,https://www.skinnytaste.com/wp-content/uploads/2012/09/Skinny-Pumpkin-Overnight-Oats-9.jpg,"DF, GF, HF, V","Easy Pumpkin Overnight Oats, a healthy, fall, plant-based breakfast that's perfect for meal prep. No cooking required!",https://www.skinnytaste.com/skinny-pumpkin-overnight-oats-in-jar/
15-Minute Protein Chia Seed Cereal,Cals:318,5,https://www.skinnytaste.com/wp-content/uploads/2022/09/Protein-Chia-Seed-Cereal-4.jpg,"DF, GF, HP, HF, Q, V",The viral chia seed cereal only with protein!,https://www.skinnytaste.com/15-minute-protein-chia-seed-cereal/
Fish Taco Bowl,Cals:264,4,https://www.skinnytaste.com/wp-content/uploads/2022/09/Fish-Taco-Bowls-5.jpg,"AF, DF, GF, HP, LC, Q, W","If you need a high protein, low-carb dish you can whip up in under 20 minutes, these Fish Taco Bowls are it! Air fryer or saute 6 minutes!",https://www.skinnytaste.com/fish-taco-bowls/
Heirloom Tomato Galette,Cals:153,6,https://www.skinnytaste.com/wp-content/uploads/2022/09/Heirloom-Tomato-Galette-5.jpg,V,"This Heirloom Tomato Galette is delicious and deceptively easy to make with refrigerated pie dough, summer tomatoes, shallots and pesto.",https://www.skinnytaste.com/heirloom-tomato-galette/
Air Fryer Sweet Plantains (Maduros),Cals:109,4,https://www.skinnytaste.com/wp-content/uploads/2022/08/Air-Fryer-Plantains-5.jpg,"AF, DF, GF, KF, Q, V, W",Air Fryer Sweet Plantains or Maduros are an easy and healthy way to make this classic Latin side dish.,https://www.skinnytaste.com/air-fryer-sweet-plantains/
Three-Cheese Zucchini Quiche,Cals:307,7,https://www.skinnytaste.com/wp-content/uploads/2022/08/3-Cheese-Zucchini-Quiche-5.jpg,FM,"This delicious Three-Cheese Zucchini Quiche, made lighter without heavy cream, is perfect for end-of-summer zucchini for breakfast, brunch or lunch.",https://www.skinnytaste.com/zucchini-quiche/
Raspberry Coconut Chia Pudding Popsicles,Cals:74,2,https://www.skinnytaste.com/wp-content/uploads/2012/08/Raspberry-Coconut-Chia-Pudding-Pops-_FINAL09.jpg,"DF, FM, GF, LC, V",These easy Raspberry Coconut Chia Pudding Popsicles are perfect as a healthy snack or dessert on a hot summer day.,https://www.skinnytaste.com/raspberry-coconut-chia-pudding-pops/
Spaghetti and Meatball Soup,Cals:213,4,https://www.skinnytaste.com/wp-content/uploads/2011/12/Meatball-and-Spaghetti-Soup-8.jpg,"FM, KF, Q","Kid friendly, one-pot Spaghetti and Meatball Soup made with turkey meatballs simmered in a light tomato broth!",https://www.skinnytaste.com/meatball-and-spaghetti-soup-5-ww-pts/
Chicken Caprese Skillet,Cals:419,8,https://www.skinnytaste.com/wp-content/uploads/2020/08/Caprese-Chicken-Skillet-5.jpg,"GF, LC",This easy chicken caprese is cooked in a skillet and topped a honey balsamic reduction and fresh basil – the perfect way to use fresh summer tomatoes.,https://www.skinnytaste.com/caprese-chicken-skillet/
Creamy Corn Soup with Queso Fresco,Cals:206,5,https://www.skinnytaste.com/wp-content/uploads/2013/07/Corn-Soup-with-Queso-Fresco-7.jpg,"GF, Q, V",A creamy corn soup made with fresh sweet summer corn thickened with a potato that's sweet and savory topped with queso fresco or cotija cheese.,https://www.skinnytaste.com/creamy-corn-soup-with-queso-fresco-and/
"Grilled Chicken Panini with Zucchini, Tomato, and Mozzarella",Cals:433,11,https://www.skinnytaste.com/wp-content/uploads/2022/08/Chicken-Panini-3.jpg,"HP, Q","This delicious Grilled Chicken Panini with Zucchini, Tomato, and Mozzarella highlights end-of-summer vegetables on sour dough bread.",https://www.skinnytaste.com/grilled-chicken-panini-with-zucchini-tomato-and-mozzarella/
Tuna Tartare,Cals:114,1,https://www.skinnytaste.com/wp-content/uploads/2022/08/Tuna-Tartare-with-Cucumber-7-1.jpg,"DF, GF, LC, Q, W","Tuna tartare may sound fancy, but it’s really easy to make! Combine fresh sushi grade tuna, cucumber, avocado, scallions, and the sauce ingredients and serve chilled with chips.",https://www.skinnytaste.com/tuna-tartare-with-cucumber-and-avocado/
BLT Roll Ups with Turkey and Avocado,Cals:341,9,https://www.skinnytaste.com/wp-content/uploads/2019/07/BLT-Roll-Ups-with-Turkey-and-Avocado-6.jpg,"KF, Q",Easy BLT Roll Ups with Turkey and Avocado are delicious and perfect for school lunch.,https://www.skinnytaste.com/blt-roll-ups-with-turkey-and-avocado/
Wonton Chips,Cals:70,2,https://www.skinnytaste.com/wp-content/uploads/2022/08/Baked-Wonton-Chips-5.jpg,"DF, Q, V","Crispy, golden baked wonton chips—perfect for scooping up tuna tartare, poke, salsa, or your favorite dip.",https://www.skinnytaste.com/baked-wonton-chips/
Homemade Kansas City Style BBQ Sauce,Cals:65,3,https://www.skinnytaste.com/wp-content/uploads/2012/04/Kansas-City-BBQ-Sauce-9.jpg,"DF, GF, V","Sweet and spicy Kansas City style BBQ sauce made with tomato sauce, honey, molasses, vinegar and spices.",https://www.skinnytaste.com/homemade-kansas-style-bbq-sauce/
Lentil Salad,Cals:181,1,https://www.skinnytaste.com/wp-content/uploads/2014/07/Lentil-Salad-5.jpg,"DF, GF, HF, V","This healthy Lentil Salad with cooked lentils and diced carrots, celery, bell pepper, onion, parsley, and lemon juice is perfect for making ahead for lunch!",https://www.skinnytaste.com/lentil-salad/
Air Fryer Popcorn Chicken,Cals:283,4,https://www.skinnytaste.com/wp-content/uploads/2022/08/Air-Fryer-Popcorn-Chicken-5.jpg,"AF, DF, HP, KF","This easy Air Fryer Popcorn Chicken recipe is kid-friendly, lighter and healthier than your typical fast-food version!",https://www.skinnytaste.com/air-fryer-popcorn-chicken/
Easy Zucchini Casserole,Cals:83,2,https://www.skinnytaste.com/wp-content/uploads/2008/08/Zucchini-Casserole-6.jpg,V,"This easyZucchini Casseroleis perfect for bringing to potlucks all summer. Just mix the ingredients, bake, and enjoy!",https://www.skinnytaste.com/zucchini-casserole-25-pts/
Pineapple Chia with Cottage Cheese,Cals:295,7,https://www.skinnytaste.com/wp-content/uploads/2022/07/Pineapple-Chia-with-Cottage-Cheese-6.jpg,"GF, HP, HF, MP, V","Pineapple Chia with Cottage Cheese, made with four ingredients, is an easy high-protein vegetarian breakfast or snack idea.",https://www.skinnytaste.com/pineapple-chia-with-cottage-cheese/
Giant Zucchini Parmesan,Cals:242,5,https://www.skinnytaste.com/wp-content/uploads/2022/07/Giant-Zucchini-Parmesan-9.jpg,"AF, GF, KF, V","If you have a giant zucchini in your garden and don’t know what to do with it, make this Giant Zucchini Parmesan – it’s so good!",https://www.skinnytaste.com/giant-zucchini-parmesan/
Peach Pie Cottage Cheese Bowls,Cals:272,5,https://www.skinnytaste.com/wp-content/uploads/2022/07/Peach-Pie-Cottage-Cheese-Bowls-3.jpg,"HP, Q, V","Peach Pie Cottage Cheese Bowls is a delicious, high protein breakfast made with fresh, ripe summer peaches.",https://www.skinnytaste.com/peach-pie-cottage-cheese-bowls/
Scallops with Corn and Tomatoes,Cals:269,8,https://www.skinnytaste.com/wp-content/uploads/2022/07/Seared-Scallops-with-Creamy-Corn-Tomatoes-and-Chives-6.jpg,"GF, Q","Scallops pair beautifully with sweet summer corn and tomatoes, made creamy with Boursin cheese.",https://www.skinnytaste.com/scallops-with-corn-and-tomatoes/
Gandules Guisados (Stewed Pigeon Peas),Cals:131,1,https://www.skinnytaste.com/wp-content/uploads/2022/07/Gandules-4.jpg,"DF, FM, GF, Q, V",A quick and easy recipe for Gandules Guisados using canned pigeon peas simmered in a tomato-based sauce with sofrito is an inexpensive side dish loaded with flavor!,https://www.skinnytaste.com/gandules-guisados-stewed-pigeon-peas/
Corn Tomato Avocado Salad,Cals:128,2,https://www.skinnytaste.com/wp-content/uploads/2018/07/Corn-Tomato-Avocado-Salad-1-9.jpg,"DF, GF, Q, V","This Corn Tomato Avocado Salad is summer in a bowl! The perfect side dish with anything you’re grilling, or double the portion as a main dish.",https://www.skinnytaste.com/corn-tomato-avocado-salad/
Puerto Rican Sofrito Recipe,Cals:27,0,https://www.skinnytaste.com/wp-content/uploads/2022/07/Puerto-Rican-Sofrito-5.jpg,"DF, FM, GF, LC, Q, V, W","Puerto Rican Sofrito is the base for so many dishes, like stews, roast pork, bistec, and beans, made with fresh cilantro, garlic, onions, bell peppers, and other ingredients.",https://www.skinnytaste.com/puerto-rican-sofrito/
"Summer Cavatelli Pasta with Corn, Tomatoes and Zucchini",Cals:297.5,7,https://www.skinnytaste.com/wp-content/uploads/2017/07/Summer-Cavatelli-with-Corn-Tomatoes-and-Zucchini-8.jpg,"Q, V","I love this quick, summer pasta dish made with homemade Cavatelli pasta, cherry tomatoes, zucchini, corn and marinara.",https://www.skinnytaste.com/summer-cavatelli-with-corn-tomatoes-and-zucchini/
Pollo Sabroso (Broiled or Grilled),Cals:181,5,https://www.skinnytaste.com/wp-content/uploads/2010/06/Pollo-Sabroso-9.jpg,"DF, GF, KF, LC, W",My family’s favorite chicken recipe is this Broiled or Grilled Pollo Sabroso seasoned with Latin flavors to create the most deliciousgrilled chicken thighs.,https://www.skinnytaste.com/broiled-or-grilled-pollo-sabroso/
Bacon-Wrapped Air Fryer Chicken Breast,Cals:332,6,https://www.skinnytaste.com/wp-content/uploads/2022/07/Air-Fryer-Bacon-Wrapped-Chicken-Breast-3.jpg,"AF, DF, GF, HP, KF, LC, Q, W",Want the juiciest chicken breasts? Make this easy Air Fryer Bacon-Wrapped Chicken Breast recipe! Just 2 ingredients not counting salt and pepper!,https://www.skinnytaste.com/bacon-wrapped-air-fryer-chicken-breast/
Broiled Fish with Tomato Caper Sauce,Cals:257,3,https://www.skinnytaste.com/wp-content/uploads/2009/03/Broiled-Tilapia-with-Tomato-Caper-Sauce-5.jpg,"DF, GF, LC, Q","Broiled Fish with Tomato Caper Sauce is an easy fish recipe with fresh tomatoes, garlic, shallots and capers that’s ready in under 20 minutes.",https://www.skinnytaste.com/broiled-tilapia-with-tomato-caper-sauce/
"Red, White and Blueberry Trifle",Cals:158,7,https://www.skinnytaste.com/wp-content/uploads/2015/06/red-white-and-blueberry-trifle.jpg,"KF, V","A heavenly mixed berry trifle made with summer fresh blueberries, strawberries, white chocolate pudding, angel foods cake and whipped cream.",https://www.skinnytaste.com/red-white-and-blueberry-trifle/
Chickpea Milanese,Cals:320,7,https://www.skinnytaste.com/wp-content/uploads/2022/06/Chickpea-Milanese-5.jpg,"DF, GF, HF, Q, V","Vegetarian Chickpea Milanese made with a chickpea flour cutlet topped with arugula salad with canned chickpeas, tomatoes, and fresh lemon.",https://www.skinnytaste.com/chickpea-milanese/
Greek 7 Layer Dip,Cals:93,2,https://www.skinnytaste.com/wp-content/uploads/2015/06/Greek-7-Layer-Dip-7.jpg,"LC, Q, V","This 7 Layer Greek Dip is layered withhummus, garlic-lemon Greek yogurt topped with cucumbers, tomatoes, red onions, feta, and kalamata olives. Grab some pita chips and serve it at your next party!",https://www.skinnytaste.com/greek-7-layer-dip/
"Black Bean, Avocado, Cucumber and Tomato Salad",Cals:94,1,https://www.skinnytaste.com/wp-content/uploads/2010/07/Black-Bean-Avocado-Cucumber-and-Tomato-Salad-4.jpg,"DF, GF, Q, V","A touch of lime and a little cilantro makes this black bean, avocado, cucumber and tomato salad a perfect companion for grilled chicken or steak.",https://www.skinnytaste.com/black-bean-avocado-cucumber-and-tomato/
Air Fryer Baked Potato,Cals:157,0,https://www.skinnytaste.com/wp-content/uploads/2022/06/Air-Fryer-Baked-Potato_1-2.jpg,"AF, DF, GF, KF, V, W","Restaurant-style baked potatoes with crispy, salted skins and fluffy insides turn out perfectly in the air fryer at a fraction of the time it would take to make them in the oven.",https://www.skinnytaste.com/air-fryer-baked-potato/
Peruvian Grilled Chicken Skewers,Cals:289,2,https://www.skinnytaste.com/wp-content/uploads/2022/06/Peruvian-Grilled-Chicken-7-scaled.jpg,,"These Peruvian Grilled Chicken Skewers with Avocado Aji Verde Sauce are my favorite, so flavorful and great for summer grilling!",https://www.skinnytaste.com/peruvian-grilled-chicken-skewers/
Mango Coconut Chia Pudding,Cals:227,5,https://www.skinnytaste.com/wp-content/uploads/2012/06/Mango-Coconut-Chia-Pudding-6.jpg,"DF, GF, HF, V","This Mango Coconut Chia Pudding is made with coconut milk, almond milk, chia seeds, shredded coconut and mango.",https://www.skinnytaste.com/mango-coconut-chia-pudding/
Watermelon Arugula and Feta Salad,Cals:157.5,5,https://www.skinnytaste.com/wp-content/uploads/2011/07/Watermelon-and-Feta-Salad-6.jpg,"GF, Q, V","Watermelon Arugula and Feta Salad is a refreshing summer salad, great with anything you're grilling!",https://www.skinnytaste.com/watermelon-and-feta-salad-3-pts/
Grilled Chicken Chickpea Salad,Cals:462,6,https://www.skinnytaste.com/wp-content/uploads/2022/05/Grilled-Chicken-Feta-Chickpea-Salad-6.jpg,"GF, HP, HF, MP, Q","Grilled Chicken Chickpea Salad is a fresh and simple high-protein lunchthat can be eaten cold on the go at work, the beach, or anywhere else you’re headed this summer.",https://www.skinnytaste.com/grilled-chicken-chickpea-salad/
