Recipe Name,Calories,Personal Points,Image URL,Recipe Keys,Summary,URL
Escarole Pasta with Sausage and Peppers,Cals:298,10,https://www.skinnytaste.com/wp-content/uploads/2011/03/Pasta-with-Italian-Chicken-Sausage-4-2.jpg,"GF, HF, Q","Pasta with Italian Chicken Sausage, Peppers and Escarole is an easy weeknight dish!",https://www.skinnytaste.com/pasta-with-italian-chicken-sausage-2/
Snowman Chocolate Bark,Cals:118,5,https://www.skinnytaste.com/wp-content/uploads/2023/11/Snowman-Bark-1.jpg,"HF, KF, V","Snowman Chocolate Bark is a fun, sweet treat, perfect for the holidays, Christmas, or winter. Mini marshmallows, chocolate, pretzel sticks, and sprinkles create adorable snowmen, excellent for gift-giving.",https://www.skinnytaste.com/snowman-chocolate-bark/
Coconut Macaroons,Cals:129,6,https://www.skinnytaste.com/wp-content/uploads/2012/04/Coconut-Macaroons-11.jpg,"DF, GF","Made with sweetened coconut flakes, egg whites, and just a few other ingredients, theseCoconut Macaroonsare moist, chewy, and perfectly flavored. They're wonderful for Passover and Christmas baking but can be enjoyed anytime.",https://www.skinnytaste.com/coconut-macaroons/
Spinach-Artichoke Crostini,Cals:97,3,https://www.skinnytaste.com/wp-content/uploads/2023/11/Spinach-Artichoke-Crostini-9.jpg,V,These Spinach-Artichoke Crostini are topped with a rich and creamy spread that is easy to assemble for a holiday appetizer!,https://www.skinnytaste.com/spinach-artichoke-crostini/
The 4 Best Meal Prep Containers of 2024,,,https://www.skinnytaste.com/wp-content/uploads/2023/08/meal-prep-breakfast-taco-1.jpeg,,"I love meal planning. Each and every week I come up with a new7-day meal planso I don’t have to stress about what to make for my family. You’ll need some of the best meal prep containers to prepare foods in advance and save leftovers for lunch, so you’re not cooking all the time. I have some of my favorites that I have found that helps me save time and money and stay on track of leading a healthy lifestyle.",https://www.skinnytaste.com/best-meal-prep-containers/
Cheddar Biscuits,Cals:185,6,https://www.skinnytaste.com/wp-content/uploads/2023/11/231023_garlic-cheddar-biscuits-32.jpg,V,"These homemade Garlic Cheddar Biscuits, made healthier with Greek yogurt, are golden brown, light, and flaky!",https://www.skinnytaste.com/cheddar-biscuits/
Slow Cooker Black Eyed Peas with Ham,Cals:115,1,https://www.skinnytaste.com/wp-content/uploads/2010/09/Black-Eye-Peas-6.jpg,"DF, FM, GF, HF, SC","Ring in the New Year, or enjoy them at any time of year, with this comforting Southern-style recipe for crockpot black-eyed peas with ham!",https://www.skinnytaste.com/slow-cooked-black-eyed-peas-with-ham/
Chewy Chocolate Chip Cookies (Low-Fat),Cals:133,6,https://www.skinnytaste.com/wp-content/uploads/2011/08/231128_chocolate-chip-cookies-24.jpg,"KF, Q","These are the best, soft and chewy Chocolate Chip Cookies! Lightly sweetened with only 3 tablespoons of coconut oil (in place of butter) in the entire batch!",https://www.skinnytaste.com/best-low-fat-chocolate-chip-cookies/
Oatmeal Chocolate Chip Cookies,Cals:64,3,https://www.skinnytaste.com/wp-content/uploads/2019/12/Low-FatChewyChocolateChipOatmealCookies-18.jpg,V,"These chewy, Oatmeal Chocolate Chip Cookies are moist and made lighter by swapping out most of the butter for applesauce!",https://www.skinnytaste.com/low-fat-chewy-chocolate-chip-oatmeal/
Free 7 Day Healthy Meal Plan (Dec 4-10),,,https://www.skinnytaste.com/wp-content/uploads/2023/12/Week_409_Dec-4-to10.jpg,,"A free 7-day, flexibleweight loss meal planincludingbreakfast,lunchanddinner ideasand a shopping  list.All recipesincludemacrosandWeight Watcherspoints.",https://www.skinnytaste.com/free-7-day-healthy-meal-plan-dec-4-10/
The Best Lasagna Recipe,Cals:394,7,https://www.skinnytaste.com/wp-content/uploads/2023/09/Lasagna-12.jpg,"FM, GF, HP, KF, MP","This easy, classic lasagna recipe is made with a ground beef meat sauce, no- cook noodles, and cottage cheese for extra protein!",https://www.skinnytaste.com/lasagna-recipe/
Leftover Turkey Noodle Soup,Cals:131,3,https://www.skinnytaste.com/wp-content/uploads/2011/11/Leftover-Turkey-Noodle-Soup-9.jpg,"FM, KF, Q",My favorite way to use leftover turkey is to make a delicious pot of turkey noodle soup. It’s also an excellent way to clean out your refrigerator!,https://www.skinnytaste.com/leftover-turkey-noodle-soup/
10+ Best Chicken Tenderloin Recipes,,,https://www.skinnytaste.com/wp-content/uploads/2023/11/Chicken-Tenderloin-Recipes.png,,"Made with just a handful of ingredients, Baked Chicken Tenderloin Parmesan is a quick and easy twist on classic chicken parm. No frying required and ready in just over 30 minutes.",https://www.skinnytaste.com/10-best-chicken-tenderloin-recipes/
Free 7 Day Healthy Meal Plan (Nov 20-26),,,https://www.skinnytaste.com/wp-content/uploads/2023/11/Week_408_Nov-20-Nov-26.jpg,,"A free 7-day, flexibleweight loss meal planincludingbreakfast,lunchanddinner ideasand a shopping  list.All recipesincludemacrosandWeight Watcherspoints.",https://www.skinnytaste.com/free-7-day-healthy-meal-plan-nov-20-26/
10 Easy Thanksgiving Leftover Recipes,,,https://www.skinnytaste.com/wp-content/uploads/2021/11/Turkey-Mashed-Potato-Pot-Pie-7.jpg,,This Leftover Turkey Enchilada recipe is a one-pan skillet meal! A super tasty way to use up leftover turkey (or chicken) and vegetables!,https://www.skinnytaste.com/thanksgiving-leftover-recipes/
Free 7 Day Healthy Meal Plan (Nov 27- Dec 3),,,https://www.skinnytaste.com/wp-content/uploads/2023/11/IMG_9330.jpg,,"A free 7-day, flexibleweight loss meal planincludingbreakfast,lunchanddinner ideasand a shopping  list.All recipesincludemacrosandWeight Watcherspoints.",https://www.skinnytaste.com/free-7-day-healthy-meal-plan-nov-27-dec-3/
Sweet Potato Gratin,Cals:212,5,https://www.skinnytaste.com/wp-content/uploads/2023/11/Sweet-Potato-Gratin-5.jpg,"GF, V","This savory Sweet Potato Gratin is inspired by Pommes Anna, a French dish of creamy, thinly sliced potatoes with rich buttery flavor topped with melted Gruyere cheese.",https://www.skinnytaste.com/sweet-potato-gratin/
Lemon Brussel Sprouts,Cals:59,0,https://www.skinnytaste.com/wp-content/uploads/2023/11/Lemon-Brussels-Sprouts-8.jpg,"DF, GF, HF, LC, Q, V, W","Crisp-tender Lemon Brussel Sprouts are light and bright, made with shaved brussels sprouts, a little chicken broth, lemon juice, and zest.",https://www.skinnytaste.com/lemon-brussel-sprouts/
Leftover Turkey Enchiladas Skillet,Cals:315,5,https://www.skinnytaste.com/wp-content/uploads/2023/11/Leftover-Turkey-Pumpkin-Enchilada-Skillet-9.jpg,"GF, HP, HF",This Leftover Turkey Enchilada recipe is a one-pan skillet meal! A super tasty way to use up leftover turkey (or chicken) and vegetables!,https://www.skinnytaste.com/leftover-turkey-enchiladas-skillet/
Twice Baked Sweet Potatoes with Marshmallows,Cals:142,3,https://www.skinnytaste.com/wp-content/uploads/2023/11/Twice-Baked-Sweet-Potatoes-with-Marshmallows-7.jpg,V,Twice Baked Sweet Potatoes with Marshmallows are like personal sweet potato casseroles—the perfect Thanksgiving side dish!,https://www.skinnytaste.com/twice-baked-sweet-potatoes-with-marshmallows/
Turkey Stock for Gravy,Cals:17,0,https://www.skinnytaste.com/wp-content/uploads/2023/11/Turkey-Stock-8.jpg,"DF, LC, MP, W","Made with just a handful of ingredients in one pot, this rich and flavorfulTurkey Stock recipeis the secret to creating a memorable turkey gravy. You'll never buy stock at the store again!",https://www.skinnytaste.com/turkey-stock-for-gravy/
Cornbread Muffins,Cals:170,6,https://www.skinnytaste.com/wp-content/uploads/2023/11/cornbread-muffins-10.jpg,"DF, GF, KF, Q, V","Adding fresh corn to cornbread muffins makes them moist and delicious, you'll never know they're light!",https://www.skinnytaste.com/cornbread-muffins/
Make-Ahead Low-Carb Turkey Gravy (Flourless),Cals:53,0,https://www.skinnytaste.com/wp-content/uploads/2023/11/Flourless-Gravy-9.jpg,"DF, GF, LC",Rich turkey stock and pureed roasted vegetables create a creamy low-carb turkey gravy without flour.,https://www.skinnytaste.com/low-carb-gravy/
Turkey Gravy,Cals:33,1,https://www.skinnytaste.com/wp-content/uploads/2023/11/Turkey-Gravy-6.jpg,"DF, LC",This homemade Turkey Gravy from stock is my mom’s tried and true recipe. It’s a staple on our Thanksgiving table every year. See myturkey stock recipeto make this.,https://www.skinnytaste.com/turkey-gravy/
Turkey Roulade (Stuffed Turkey Breast),Cals:484,3,https://www.skinnytaste.com/wp-content/uploads/2020/10/Stuffed-Turkey-Breast-with-Cranberry-Stuffing-11.jpg,,This Turkey Roulade with Cranberry Stuffing and gravy is the perfect Thanksgiving or Holiday meal for a smaller gathering.,https://www.skinnytaste.com/stuffed-turkey-breast-with-cranberry-stuffing/
Sweet Potato Casserole with Marshmallows,Cals:132.5,3,https://www.skinnytaste.com/wp-content/uploads/2011/10/sweet-potato-casserole-with-marshmallows-1-3.jpg,"GF, V","Sweet potatoes, golden raisins, crushed pineapple and spices are topped with pecans and mini marshmallows, then baked until golden.",https://www.skinnytaste.com/sweet-potato-casserole/
Free 7 Day Healthy Meal Plan (Nov 6-12),,,https://www.skinnytaste.com/wp-content/uploads/2023/11/Week_406_Nov-6-Nov-12.jpg,,"A free 7-day, flexibleweight loss meal planincludingbreakfast,lunchanddinner ideasand a shopping  list.All recipesincludemacrosandWeight Watcherspoints.",https://www.skinnytaste.com/free-7-day-healthy-meal-plan-nov-6-12/
Roasted Delicata Squash and Brussels Sprouts,Cals:213,2,https://www.skinnytaste.com/wp-content/uploads/2023/11/Delicata-Squash-and-Brussels-Sprouts-5.jpg,"DF, HF, V","Roasted Delicata Squash and Brussels Sprouts drizzled with a balsamic glaze, is a true celebration of fall on a plate, a wonderful side dish with your favorite protein.",https://www.skinnytaste.com/roasted-delicata-squash-and-brussels-sprouts/
Meximelt,Cals:224,7,https://www.skinnytaste.com/wp-content/uploads/2023/10/Meximelts-9.jpg,"HP, HF, KF",This healthier Meximelt copycat recipe is made with ground turkey seasoned with my homemade taco seasoning wrapped in a tortilla with melted cheese and pico de gallo. Easy and delicious!,https://www.skinnytaste.com/meximelt/
Free 7 Day Healthy Meal Plan (Nov 13-19),,,https://www.skinnytaste.com/wp-content/uploads/2023/11/Week_407_Nov-13-Nov-19.jpg,,"A free 7-day, flexibleweight loss meal planincludingbreakfast,lunchanddinner ideasand a shopping  list.All recipesincludemacrosandWeight Watcherspoints.",https://www.skinnytaste.com/free-7-day-healthy-meal-plan-nov-13-19/
Mashed Sweet Potatoes,Cals:151,1,https://www.skinnytaste.com/wp-content/uploads/2012/10/Mashed-Sweet-Potatoes-5.jpg,"Q, V","Mashed sweet potatoes are often smothered in sugar, but this savory recipe is healthy and just as delicious! Your loved ones will keep coming back for more.",https://www.skinnytaste.com/garlic-sweet-potato-mash/
Butternut Squash Lasagna (No-Noodle),Cals:402,10,https://www.skinnytaste.com/wp-content/uploads/2016/09/Noodle-less-Butternut-Sausage-Lasagna-8.jpg,"FM, GF, HF, LC","This fall butternut squash lasagna swaps pasta for butternut squash layered with a chicken sausage meat sauce, ricotta, and mozzarella. Simply wonderful, you won't miss the pasta!",https://www.skinnytaste.com/noodle-less-butternut-sausage-lasagna/
Cheesy Baked Pumpkin Pasta,Cals:307,8,https://www.skinnytaste.com/wp-content/uploads/2013/11/baked-pumpkin-pasta-12.jpg,"GF, HF","This Cheesy Baked Pumpkin Pasta is baked in the oven with a quick pumpkin sauce made with bacon, shallots, Pecorino cheese and a touch of rosemary then topped with mozzarella cheese.",https://www.skinnytaste.com/cheesy-baked-pumpkin-pasta/
Slow Cooker Chicken Enchiladas,Cals:315,5,https://www.skinnytaste.com/wp-content/uploads/2023/10/Slow-Cooker-Chicken-Enchiladas-6.jpg,"GF, HP, HF, MP, SC","I’m obsessed with these easy, Slow Cooker Chicken Enchiladas, made with black beans, tortillas, my homemade enchilada sauce, and cheese.",https://www.skinnytaste.com/slow-cooker-chicken-enchiladas/
Green Beans with Mushrooms,Cals:88,2,https://www.skinnytaste.com/wp-content/uploads/2023/10/green-beans-with-mushrooms-8.jpg,"GF, LC, Q","This Green Beans with Mushrooms recipe is an easy stove-top side dish with all the elements of a green bean casserole, but it doesn’t take up valuable oven space.",https://www.skinnytaste.com/green-beans-with-mushrooms/
Free 7 Day Healthy Meal Plan (Oct 30-Nov 5),,,https://www.skinnytaste.com/wp-content/uploads/2023/10/Week_405_Oct-30-Nov-5-1.jpg,,"A free 7-day, flexibleweight loss meal planincludingbreakfast,lunchanddinner ideasand a shopping  list.All recipesincludemacrosandWeight Watcherspoints.",https://www.skinnytaste.com/free-7-day-healthy-meal-plan-oct-30-nov-5/
Free 7 Day Healthy Meal Plan (Oct 16-22),,,https://www.skinnytaste.com/wp-content/uploads/2023/10/Week_403_Oct-16-Oct-22.jpg,,"A free 7-day, flexibleweight loss meal planincludingbreakfast,lunchanddinner ideasand a shopping  list.All recipesincludemacrosandWeight Watcherspoints.",https://www.skinnytaste.com/free-7-day-healthy-meal-plan-oct-16-22/
White Bean Pumpkin Turkey Chili (Slow Cooker or Instant Pot),Cals:272.5,0,https://www.skinnytaste.com/wp-content/uploads/2011/10/SLOW-COOKER-TURKEY-PUMPKIN-WHITE-BEAN-CHILI-3.jpg,"FM, GF, HF, PC, SC","The best White Bean Pumpkin Turkey Chili recipe (Slow cooker or Instant Pot) made with pumpkin puree, ground turkey and green chili & spices.",https://www.skinnytaste.com/crockpot-turkey-white-bean-pumpkin/
Beef Stew,Cals:439,1,https://www.skinnytaste.com/wp-content/uploads/2023/10/Beef-Stew-Recipe-8.jpg,"DF, FM, GF, HP","This classic beef stew recipe is the ideal cozy dinner for a chilly weekend. Made with chunks of beef, carrots, potatoes, onion, celery, peas, and mushrooms for a comforting meal.",https://www.skinnytaste.com/beef-stew/
Mummy Hot Dogs,Cals:81,2,https://www.skinnytaste.com/wp-content/uploads/2023/10/Mummy-Dogs-8.jpg,KF,The kids will love these homemade Mummy Dogs this Halloween made with turkey hot dogs – a fun kid- friendly appetizer for your Halloween party!,https://www.skinnytaste.com/mummy-hot-dogs/
Pumpkin Mug Cake,Cals:134,4,https://www.skinnytaste.com/wp-content/uploads/2023/10/231005_Recipe-Session-068-copy.jpg,"GF, Q","This quick and easy microwave Pumpkin Mug Cake is the perfect fall dessert for one, or multiply the recipe and make it in ramekins to feed a crowd!",https://www.skinnytaste.com/pumpkin-mug-cake/
Air Fryer Chicken Bites,Cals:233,1,https://www.skinnytaste.com/wp-content/uploads/2023/10/air-fryer-chicken-bites-6.jpg,"AF, DF, FM, HP, LC, MP, Q","These easy, high-protein Air Fryer Chicken Bites, made with boneless skinless chicken breast chunks, are perfect for a quick dinner! I make a batch and use the other half for meal prep for the week.",https://www.skinnytaste.com/air-fryer-chicken-bites/
Shaved Brussels Sprout Salad with Pears and Pomegranate,Cals:154,4,https://www.skinnytaste.com/wp-content/uploads/2023/10/Shaved-Brussels-Sprouts-Salad-with-Pears-Pomegranate-and-Pepitas-6.jpg,"LC, Q, V","This delicious Shaved Brussels Sprout Salad made with juicy pears, pomegranates, pepitas, and goat cheese is the perfect fall side dish.",https://www.skinnytaste.com/shaved-brussels-sprout-salad/
Free 7 Day Healthy Meal Plan (Oct 23-29),,,https://www.skinnytaste.com/wp-content/uploads/2023/10/Week_404_Oct-23-Oct-29.jpg,,"A free 7-day, flexibleweight loss meal planincludingbreakfast,lunchanddinner ideasand a shopping  list.All recipesincludemacrosandWeight Watcherspoints.",https://www.skinnytaste.com/free-7-day-healthy-meal-plan-oct-23-29/
Parmesan Brussel Sprouts,Cals:163,4,https://www.skinnytaste.com/wp-content/uploads/2023/10/Sheet-Pan-Parmesan-Brussels-Sprouts-10.jpg,"GF, V",These crispy Parmesan Brussels Sprouts roast on a sheet pan with grated parmesan cheese and spices and are done in 30 minutes!,https://www.skinnytaste.com/parmesan-brussel-sprouts/
Mummy Jalapeno Poppers,Cals:65,2,https://www.skinnytaste.com/wp-content/uploads/2023/10/Mummy-Jalapeno-Poppers-8.jpg,V,"These cute, spicy Mummy Jalapeño Poppers are the perfect Halloween appetizer for your Halloween Party!",https://www.skinnytaste.com/mummy-jalapeno-poppers/
Roasted Pumpkin Seeds,Cals:72,3,https://www.skinnytaste.com/wp-content/uploads/2011/09/Roasted-Pumpkin-Seeds-9.jpg,"DF, GF, LC, V","Roasted pumpkin seedsare a fun and easy snack to make with your kids, especially after carving a pumpkin. Season with just plain salt for a savory snack, toss them in cinnamon sugar for a sweet treat, or add any other flavors desired for a custom treat.",https://www.skinnytaste.com/roasted-pumpkin-seeds/
Instant Pot Brown Rice,Cals:184,5,https://www.skinnytaste.com/wp-content/uploads/2023/09/230922_instant-pot-brown-rice-15.jpg,"DF, FM, GF, MP, PC, V","This recipe for Perfect Instant Pot Brown Rice is so easy and flavorful, perfect for people who struggle to make rice.",https://www.skinnytaste.com/instant-pot-brown-rice/
Autumn Kale Salad with Chicken,Cals:504,9,https://www.skinnytaste.com/wp-content/uploads/2023/09/Fall-Chopped-Salad-with-Chicken-7.jpg,"GF, HP, HF, MP","This high-protein Autumn Kale Salad with Chicken is made with roasted butternut squash, kale, apples, pecans, and goat cheese with a maple-Dijon vinaigrette.",https://www.skinnytaste.com/kale-salad-with-chicken/
Roasted Sweet Potatoes,Cals:215,2,https://www.skinnytaste.com/wp-content/uploads/2023/09/Roasted-Sweet-Potatoes-10.jpg,"DF, GF, HF, V, W",Sweet and savory roasted sweet potatoes are the perfect side dish for your favorite fall and winter dishes.,https://www.skinnytaste.com/roasted-sweet-potatoes/
Free 7 Day Healthy Meal Plan (Oct 2-8),,,https://www.skinnytaste.com/wp-content/uploads/2023/09/Week_401_Oct-2-Oct-8.jpg,,"A free 7-day, flexibleweight loss meal planincludingbreakfast,lunchanddinner ideasand a shopping  list.All recipesincludemacrosandWeight Watcherspoints.",https://www.skinnytaste.com/free-7-day-healthy-meal-plan-oct-2-8/
Minestrone Soup,Cals:175,2,https://www.skinnytaste.com/wp-content/uploads/2023/09/Stovetop-Minestrone-Soup-7.jpg,"FM, GF, HF, MP","This is the best minestrone soup recipe, a hearty, vegetable-rich Italian soup made from scratch with plenty of fiber from the beans and vegetables. Perfect for serving with crusty bread.",https://www.skinnytaste.com/minestrone-soup/
23 Easy Crock Pot Chicken Recipes,,,https://www.skinnytaste.com/wp-content/uploads/2023/05/23-crock-pot-chicken.png,SC,This hearty and healthy chicken chili is one of my most-requested recipes. And it’s no wonder why – toss all the ingredients in the crock and leave it to cook low and slow. Come back to the most flavorful homemade taco chili!,https://www.skinnytaste.com/crock-pot-chicken-recipes/
Free 7 Day Healthy Meal Plan (Oct 9-15),,,https://www.skinnytaste.com/wp-content/uploads/2023/10/Week_402_Oct-9-Oct-15.jpg,,"A free 7-day, flexibleweight loss meal planincludingbreakfast,lunchanddinner ideasand a shopping  list.All recipesincludemacrosandWeight Watcherspoints.",https://www.skinnytaste.com/free-7-day-healthy-meal-plan-oct-9-15/
Pumpkin Chocolate Chip Cookies,Cals:95,5,https://www.skinnytaste.com/wp-content/uploads/2023/09/230915_soft-pumpkin-chocolate-chip-cookies-12.jpg,"KF, Q, V","These soft Pumpkin Chocolate Chip Cookies, made with pumpkin puree, pumpkin spice, and cream cheese, have a cake-like texture and lots of pumpkin flavor!",https://www.skinnytaste.com/pumpkin-chocolate-chip-cookies/
Pumpkin Bread Recipe,Cals:103,5,https://www.skinnytaste.com/wp-content/uploads/2011/10/Pumpkin-Bread-Recipe-5.jpg,"DF, V","Warm up your kitchen with the scent of pumpkin spice and bake this pumpkin bread recipe, perfect for cozy, cool fall days.",https://www.skinnytaste.com/low-fat-pumpkin-bread-with-pepitas/
Coconut Curry Butternut Squash Soup,Cals:108,2,https://www.skinnytaste.com/wp-content/uploads/2010/10/Coconut-Curry-Butternut-Squash-Soup-5.jpg,"DF, GF, Q, V","ThisButternut Squash Soupis made with coconut milk, curry, and Indian spices which perfectly compliment the flavor of the butternut squash. It's easy to make and leftovers store well!",https://www.skinnytaste.com/coconut-curry-butternut-squash-soup/
Roasted Broccoli and Cauliflower,Cals:163,4,https://www.skinnytaste.com/wp-content/uploads/2023/09/230912_roasted-broccoli-cauliflower-09.jpg,"GF, Q","This easy sheet pan roasted broccoli and cauliflower with Parmesan, breadcrumbs, and garlic is quick and delicious!",https://www.skinnytaste.com/roasted-broccoli-and-cauliflower/
Pumpkin Baked Oatmeal Cups,Cals:104,1,https://www.skinnytaste.com/wp-content/uploads/2023/09/Pumpkin-Baked-Oatmeal-Cups-5.jpg,"FM, GF, MP, V","Made with pumpkin puree, oats, pumpkin pie spice, and Greek yogurt, thesePumpkin Baked Oatmeal Cupsare an easy, creamy breakfast full of fall flavor. They're perfect to make in advance for breakfast on-the-go!",https://www.skinnytaste.com/pumpkin-baked-oatmeal-cups/
Apple Turnover,Cals:111,2,https://www.skinnytaste.com/wp-content/uploads/2023/09/Apple-Turnovers-11.jpg,"DF, KF, V","This easy Apple Turnover recipe is filled with apples, cinnamon, and golden raisins and made with a phyllo dough crust. It’s the perfect light fall dessert or breakfast!",https://www.skinnytaste.com/apple-turnover/
Free 7 Day Healthy Meal Plan (Sept 25-Oct 1),,,https://www.skinnytaste.com/wp-content/uploads/2023/09/Week_400_Sep-25-Oct-1.jpg,,"A free 7-day, flexibleweight loss meal planincludingbreakfast,lunchanddinner ideasand a shopping  list.All recipesincludemacrosandWeight Watcherspoints.",https://www.skinnytaste.com/free-7-day-healthy-meal-plan-sept-25-oct-1/
Free 7 Day Healthy Meal Plan (Sept 18-24),,,https://www.skinnytaste.com/wp-content/uploads/2023/09/Week_399_Sep-18-Sep-24.jpg,,"A free 7-day, flexibleweight loss meal planincludingbreakfast,lunchanddinner ideasand a shopping  list.All recipesincludemacrosandWeight Watcherspoints.",https://www.skinnytaste.com/free-7-day-healthy-meal-plan-sept-18-24/
Pumpkin Chocolate Chip Muffins,Cals:160,6,https://www.skinnytaste.com/wp-content/uploads/2013/09/Mini-Pumpkin-Chocolate-Chip-Muffins-9.jpg,"KF, V",Mini Pumpkin Chocolate Chip Muffins made lighter by swapping out butter for pumpkin puree – loaded with chocolate chips in every bite!,https://www.skinnytaste.com/skinny-mini-pumpkin-chocolate-chip/
Instant Pot Rice,Cals:179,6,https://www.skinnytaste.com/wp-content/uploads/2023/09/Instant-Pot-White-Rice-4.jpg,"DF, FM, GF, MP, PC, Q, V","Making fluffy, perfect white rice in the Instant Pot is easy, delicious, and foolproof with this simple method!",https://www.skinnytaste.com/instant-pot-rice/
Apple Cobbler Recipe,Cals:215,7,https://www.skinnytaste.com/wp-content/uploads/2021/10/Skinny-Apple-Cobbler-13-2.jpg,V,Cozy and delicious Apple Cobbler recipe made from scratch with warm cinnamon apples and a golden cobbler crust.,https://www.skinnytaste.com/skinny-apple-cobbler/
Classic Egg Salad Recipe,Cals:185,3,https://www.skinnytaste.com/wp-content/uploads/2019/01/Egg-Salad-Finals-6.jpg,"DF, GF, HP, LC, MP, V, W","This classic egg salad recipe is creamy, high-protein, low-carb, and the perfect quick, make-ahead breakfast or lunch.",https://www.skinnytaste.com/classic-egg-salad/
Stuffed Shells with Meat Sauce,Cals:360.9,9,https://www.skinnytaste.com/wp-content/uploads/2011/09/Spinach-Stuffed-Shells-with-Meat-Sauce-10.jpg,"FM, GF, KF","Delicious Stuffed Shells with Meat Sauce are made with jumbo pasta shells stuffed with ricotta cheese, mozzarella and spinach in a ground turkey meat sauce. Healthy, high protein and family friendly!",https://www.skinnytaste.com/spinach-stuffed-shells-with-meat-sauce/
Chicken Nuggets,Cals:280,2,https://www.skinnytaste.com/wp-content/uploads/2023/09/Chicken-Nuggets-10.jpg,"AF, DF, GF, HP, KF, Q","These picky-kid-approved, healthy Chicken Nuggets are crispy on the outside and juicy on the inside. They’re better than ones from a fast-food restaurant and even have hidden veggies inside!",https://www.skinnytaste.com/chicken-nuggets/
Free 7 Day Healthy Meal Plan (Sept 11-17),,,https://www.skinnytaste.com/wp-content/uploads/2023/09/Week_398_Sep-11-Sep-17.jpg,,"A free 7-day, flexibleweight loss meal planincludingbreakfast,lunchanddinner ideasand a shopping  list.All recipesincludemacrosand Weight Watchers points.",https://www.skinnytaste.com/free-7-day-healthy-meal-plan-sept-11-17/
Banana Bread Recipe,Cals:123,4,https://www.skinnytaste.com/wp-content/uploads/2023/09/BananaBread-18.jpg,"DF, KF, V","When I have ripe bananas on my counter, I always crave this moist banana bread recipe made healthier with applesauce in place of butter.",https://www.skinnytaste.com/banana-bread/
Skinnytaste Simple Cookbook: Free Bonus Pack plus 2 Exclusive Recipes with Pre-Order,,,https://www.skinnytaste.com/wp-content/uploads/2023/08/Screen-Shot-2023-08-30-at-4.27.34-PM.jpg,,I’m so exciting that in just a few short weeks my new cookbook Skinnytaste Simple will finally be hitting bookstores!!,https://www.skinnytaste.com/skinnytaste-simple-cookbook-free-bonus-pack-plus-2-exclusive-recipes-with-pre-order/
Cinnamon-Raisin Overnight Oats,Cals:378,6,https://www.skinnytaste.com/wp-content/uploads/2023/08/Cinnamon_Raisin_Overnight_Oats-03.jpg,"DF, GF, HF, MP, V","Easy Cinnamon-Raisin Overnight Oats are the perfect make-ahead, healthy weekday breakfast!",https://www.skinnytaste.com/cinnamon-raisin-overnight-oats/
Free 7 Day Healthy Meal Plan (Sept 4-10),,,https://www.skinnytaste.com/wp-content/uploads/2023/08/Week_397_Sep-4-Sep-10.jpg,,"A free 7-day, flexibleweight loss meal planincludingbreakfast,lunchanddinner ideasand a shopping  list.All recipesincludemacrosand Weight Watchers points.",https://www.skinnytaste.com/free-7-day-healthy-meal-plan-sept-4-10/
